{
  "schema_version": "1.0",
  "mission_id": "ku-bo-live-adaptive-v4",
  "mission_status": "READY_FOR_CODEX_EXECUTION",
  "repository": {
    "slug": "mohsamir7122/ku-bo",
    "single_codebase": true,
    "required_entrypoint": "CODEX_START_HERE.md",
    "active_task_file": "docs/codex/CURRENT_TASK.md",
    "merge_policy": "DRAFT_PR_ONLY_UNTIL_USER_APPROVAL"
  },
  "runtime": {
    "timezone": "Asia/Kuwait",
    "primary_activation_local": "15:07",
    "watchdog_activation_local": "15:37",
    "activation_window_name": "THREE_PM_KUWAIT",
    "non_session_mode": "MAINTENANCE_ONLY",
    "scheduled_runtime_default": "DISABLED_UNTIL_AUTHORIZED",
    "manual_entry_command": "python scripts/validate_codex_live_bootstrap.py --project-root ."
  },
  "drive": {
    "logical_root_name": "AI Rebuild",
    "storage_class": "PRIVATE_RUNTIME_ONLY",
    "canonical_data_root": "04_Curated_Core/KU_BO",
    "private_import_root": "02_Google_Drive/KU_BO",
    "quarantine_root": "90_Quarantine_Duplicates/KU_BO",
    "report_root": "99_Reports/KU_BO",
    "required_canonical_subpaths": [
      "00_Manifests",
      "01_Factor9_Research",
      "02_Event_Evidence",
      "03_Market_Data",
      "04_Model_Freezes",
      "05_Daily_Reports"
    ],
    "unique_file_policy": "HASH_AND_PROVENANCE_BEFORE_CANONICAL_ADMISSION",
    "duplicate_policy": "QUARANTINE_BEFORE_ANY_DELETE",
    "overwrite_policy": "VERSIONED_NO_OVERWRITE",
    "repository_may_store_drive_ids": false,
    "repository_may_store_private_bytes": false
  },
  "factor9": {
    "asset_status": "RESEARCH_ASSET_PENDING_ADMISSION",
    "promotion_ceiling": "RESEARCH_INPUT_ONLY",
    "company_master_rows": 140,
    "price_tickers": 137,
    "original_price_rows": 534135,
    "clean_price_rows": 533997,
    "excluded_price_rows": 138,
    "reported_validation_issues": 243,
    "primary_historical_price_origin": "MUBASHER_SECONDARY",
    "historical_price_rights_status": "REQUIRES_RUNTIME_REVIEW",
    "event_label_status": "OCR_AUTO_LABELS_MEDIUM_CONFIDENCE_REVIEW_REQUIRED",
    "preserve_without_recomputing": [
      "RAW_PRICE_FILES",
      "CLEAN_PRICE_FILE",
      "EXCLUDED_ROW_FILE",
      "FAILURE_LEDGER",
      "COMPANY_MASTER",
      "PRICE_FACTOR_OUTPUTS",
      "EVENT_LIBRARY",
      "REVIEW_QUEUE"
    ],
    "known_blockers": [
      "OFFICIAL_SECURITY_IDENTITY_NOT_BOUND_FOR_EVERY_ROW",
      "AUTOMATED_REUSE_RIGHTS_NOT_PROVEN",
      "CORPORATE_ACTION_ADJUSTMENT_NOT_PROVEN_COMPLETE",
      "OCR_EVENT_LABELS_NOT_OFFICIAL_TRUTH",
      "POINT_IN_TIME_AVAILABILITY_NOT_PROVEN_FOR_EVERY_EVENT",
      "FUNDAMENTAL_AND_MARKET_CAP_FIELDS_NOT_FINAL"
    ],
    "admission_gates": [
      "HASH_BOUND_DRIVE_MANIFEST",
      "RIGHTS_AND_ACCESS_REVIEW",
      "OFFICIAL_EFFECTIVE_DATED_IDENTITY",
      "RAW_CLEAN_EXCLUSION_RECONCILIATION",
      "OFFICIAL_CORPORATE_ACTION_RECONCILIATION",
      "EVENT_LABEL_HUMAN_OR_OFFICIAL_REVIEW",
      "POINT_IN_TIME_TIMESTAMP_RECONCILIATION"
    ]
  },
  "event_training": {
    "development_major_events": 50,
    "development_control_events": 200,
    "default_training_rounds": 30,
    "maximum_training_rounds": 50,
    "extra_round_requires_preregistered_hypothesis": true,
    "development_events_allowed_in_regression_replay": true,
    "locked_test_minimum_events": 500,
    "locked_test_maximum_events": 600,
    "locked_test_may_overlap_development": false,
    "split_policy": "PURGED_EMBARGOED_WALK_FORWARD",
    "control_matching": [
      "SECTOR",
      "LIQUIDITY",
      "VOLATILITY",
      "MARKET_REGIME",
      "ELIGIBILITY_DATE"
    ],
    "missing_data_policy": "RECOVER_THEN_PROXY_FLAG_THEN_ABSTAIN",
    "trial_registry_required": true
  },
  "daily_runtime": {
    "champion_policy": "PREVIOUS_APPROVED_FREEZE_ONLY",
    "challenger_same_day_output_allowed": false,
    "champion_freeze_path": "AI Rebuild/04_Curated_Core/KU_BO/04_Model_Freezes",
    "daily_report_path": "AI Rebuild/04_Curated_Core/KU_BO/05_Daily_Reports",
    "stages": [
      "VERIFY_SESSION_AND_ACQUIRE_RUN_LOCK",
      "PROBE_AUTHORIZED_SOURCE_ACCESS",
      "COLLECT_AND_HASH_RAW_EVIDENCE",
      "VALIDATE_AND_NORMALIZE_POINT_IN_TIME",
      "BUILD_EVENT_AND_FACTOR_SNAPSHOT",
      "RUN_PREVIOUS_APPROVED_CHAMPION",
      "SEAL_DAILY_RESEARCH_OUTPUT",
      "MATURE_AND_SCORE_PRIOR_OUTCOMES",
      "TRAIN_CHALLENGERS",
      "EMIT_DRAFT_CHANGE_PROPOSALS"
    ],
    "products": [
      {
        "product_id": "three_session_rank",
        "horizon_sessions": 3
      },
      {
        "product_id": "five_session_weekly_swing",
        "horizon_sessions": 5
      },
      {
        "product_id": "twenty_one_session_monthly_swing",
        "horizon_sessions": 21
      },
      {
        "product_id": "sixty_three_session_quarter_rank",
        "horizon_sessions": 63
      }
    ],
    "allowed_decisions": [
      "RESEARCH_CANDIDATE",
      "WATCH",
      "ABSTAIN"
    ],
    "code_change_policy": "TASK_BRANCH_TESTS_DRAFT_PR_NO_AUTO_MERGE",
    "model_promotion_policy": "PROMOTE_ONLY_AFTER_LOCKED_VALIDATION_AND_PROSPECTIVE_GATES"
  },
  "source_roles": {
    "official_truth": [
      "BOURSA_KUWAIT",
      "CMA_IFSAH",
      "ISSUER"
    ],
    "secondary_research": [
      "INVESTING_AUTHORIZED_EXPORT",
      "MUBASHER_REVIEWED_SECONDARY",
      "REUTERS_OR_LOCAL_NEWS"
    ],
    "community_routing_only": [
      "TELEGRAM_AUTHORIZED_EXPORT",
      "INDEXSIGNAL_AUTHORIZED_EXPORT"
    ],
    "private_storage_only": [
      "GOOGLE_DRIVE_AI_REBUILD"
    ],
    "execution_required": [
      "LICENSED_FEED_OR_BROKER_EXPORT"
    ]
  },
  "claim_boundaries": {
    "bootstrap_is_live_runtime": false,
    "drive_presence_grants_data_rights": false,
    "factor9_is_training_truth": false,
    "factor9_is_validated_model": false,
    "challenger_may_issue_same_day_output": false,
    "scheduled_time_is_exactly_guaranteed": false,
    "automatic_code_merge_allowed": false,
    "research_candidate_is_buy_recommendation": false,
    "delayed_public_price_is_execution_quote": false,
    "structural_test_proves_predictive_skill": false
  }
}
